{
  "id": "999-fixture-positive-cycle-04",
  "title": "Positive decision fixture for cycle 4",
  "owner": "kimjooyoon",
  "status": "accepted",
  "scope": {
    "bounded_contexts": ["platform"],
    "areas": ["governance"]
  },
  "source": "top_down",
  "evidence": [
    {
      "kind": "file",
      "ref": "fixtures/positive/decision/decision-positive-cycle-${TS}.json"
    }
  ],
  "affected_repos": ["agent-cluster-contracts"],
  "ssot_owner": "agent-cluster-contracts",
  "generated_artifacts": [],
  "guards": [],
  "examples": [
    "Cycle 4 positive fixture."
  ],
  "counterexamples": [],
  "created_at": "2026-06-03"
}
