{
  "id": "999-fixture-positive-cycle-1780481038-2",
  "title": "Positive fixture for dumb-agent cycle 3",
  "owner": "kimjooyoon",
  "status": "accepted",
  "scope": {
    "bounded_contexts": ["platform"],
    "areas": ["governance"]
  },
  "source": "top_down",
  "evidence": [
    {
      "kind": "file",
      "ref": "fixtures/positive/decision/decision-positive-cycle-1780481038.json"
    }
  ],
  "affected_repos": ["agent-cluster-contracts"],
  "ssot_owner": "agent-cluster-contracts",
  "generated_artifacts": [],
  "guards": [],
  "examples": [
    "Cycle 3 positive fixture candidate."
  ],
  "counterexamples": [],
  "created_at": "2026-06-03"
}
