{
  "id": "000-fixture-positive-governance-accepted",
  "title": "Positive fixture generated by dumb-agent cycle",
  "owner": "kimjooyoon",
  "status": "accepted",
  "scope": {
    "bounded_contexts": ["platform"],
    "areas": ["governance"]
  },
  "source": "top_down",
  "evidence": [
    {
      "kind": "file",
      "ref": "fixtures/positive/decision/decision-positive-governance-accepted.json"
    }
  ],
  "affected_repos": ["agent-cluster-contracts"],
  "ssot_owner": "agent-cluster-contracts",
  "generated_artifacts": [],
  "guards": [],
  "examples": [
    "Validate a stable governance fixture with explicit evidence reference and accepted status."
  ],
  "counterexamples": [],
  "created_at": "2026-06-03"
}
